{
  "format": "deployment-ops/bootstrap-selection/v1",
  "purpose": "source-only",
  "domain_id": "a6606aee-cb29-5360-a578-3502f7b0a12a",
  "source_id": "domain",
  "ref": "refs/heads/main",
  "expected_commit": "1111111111111111111111111111111111111111",
  "adapter": {
    "implementation": "fishhat.forgejo-restic",
    "installation_digest": "sha256:aaaaaaaaaaaaaaaaaaaaaaaaaaaaaaaaaaaaaaaaaaaaaaaaaaaaaaaaaaaaaaaa",
    "descriptor_digest": "sha256:cb79b26945db330c01934b14aea2c26a5c6539d87fddfceb2b4684dbe0006da9",
    "configuration_digest": "sha256:0eae6fab2afd04f8c5485ed22106ec804b3f49c8d23465341ad4e293328d7d49",
    "source_schema_digest": "sha256:47fb03e79b10f28072cbd651a330580e89811fda9feffec9d65f3ad9580ba2fc"
  },
  "capture": {
    "digest": "sha256:1eb53009adbe60d42d3d028b1cc9b0455907c7ef3d2231bcfcd33f82569f13cd",
    "media_type": "application/json",
    "size_bytes": 281
  },
  "catalogue_digest": "sha256:2daf38a6559b8edfd9844db145d1ec60a408be50b918f6af61e06f78c41ac2ab",
  "kit_manifest_digest": "sha256:aaaaaaaaaaaaaaaaaaaaaaaaaaaaaaaaaaaaaaaaaaaaaaaaaaaaaaaaaaaaaaaa",
  "recovery_root": "/recovery/staging/run-001",
  "verify_only": true,
  "force_checkout": false,
  "install_dependencies": false,
  "download_tools": false,
  "full_service_restore_separate": true
}
